调往门店名称,商品名称
上虞万悦城新店,1896
上虞万达广场店,2233
上虞东关镇店,2261
上虞丰惠镇店,2012
上虞人民路新店,1917
上虞华维店,1909
上虞城南舜耕大道店,1948
上虞城西店,1984
上虞小越镇新店,2056
上虞峰山路店,1461
上虞崧厦东大街店,2117
上虞崧厦佳源广场店,2186
上虞恒利店,1563
上虞水尚名都店,2002
上虞江扬路新店,1799
上虞汤浦镇店,1788
上虞百官广场店,1607
上虞盖北镇店,1391
上虞舜杰路新店,2358
上虞谢塘镇店,1364
上虞道墟镇店,2076
丽水云和中山路店,1867
丽水云和中梁店,1471
丽水云和山水广场店,1747
丽水庆元农贸市场店,1762
丽水庆元和家园店,2165
丽水景宁人民南路店,1803
丽水景宁鑫景商城店,1257
丽水松阳万家惠店,1964
丽水松阳新华路店,2205
丽水松阳江泰广场店,1737
丽水缙云和泰城店,2368
丽水缙云壶镇二店,1594
丽水缙云壶镇店,1888
丽水缙云新建镇店,1768
丽水缙云溪滨北路店,1949
丽水缙云黄碧街店,2116
丽水缙云黄龙路店,1572
丽水莲都万地广场店,1875
丽水莲都中山店,1830
丽水莲都囿山路店,1867
丽水莲都天宁店,1661
丽水莲都宇雷路店,2340
丽水莲都寿尔福路店,1826
丽水莲都水东路店,1777
丽水莲都水阁店,2217
丽水莲都碧湖镇店,1960
丽水莲都秀山店,1973
丽水莲都继光街店,1707
丽水莲都西城广场店,1976
丽水莲都银泰城店,2018
丽水遂昌叶坦店,1400
丽水遂昌园丁路店,1889
丽水青田之心店,1930
丽水青田江泰广场店,1572
丽水青田涌金街店,1863
丽水龙泉万达店,1696
丽水龙泉剑池西路店,1581
丽水龙泉华楼街店,1966
义乌万体广场店,1075
义乌上溪镇店,1629
义乌义亭之心店,1438
义乌众安广场店,1921
义乌何麻车店,1341
义乌佛堂大成路店,1648
义乌佛堂宝龙广场店,2051
义乌北苑路店,1115
义乌后宅店,1713
义乌大陈镇店,1556
义乌宾王商贸区店,1767
义乌工人北路三店,1785
义乌工人北路二店,1690
义乌工人北路店,2034
义乌廿三里店,1427
义乌新科路店,1971
义乌望道路店,1519
义乌柳青店,1386
义乌江东中路二店,1511
义乌江东中路店,1680
义乌江滨西路店,1388
义乌绣湖里店,1653
义乌苏溪镇店,2013
义乌荷叶塘店,1603
义乌青口店,1604
余姚万年桥店,1776
余姚万达广场店,2180
余姚丈亭镇渔溪店,1857
余姚三七市镇店,2037
余姚世南西路店,1591
余姚世南西路绿城店,1685
余姚临山镇店,2284
余姚五彩城新店,69
余姚低塘镇店,2383
余姚兰江商贸城新店,1904
余姚南雷路店,1824
余姚嘉悦广场店,2513
余姚四明路店,1773
余姚小曹娥镇店,2143
余姚慧聪家电城店,1971
余姚文山路店,1995
余姚新大新广场店,1507
余姚新建北路店,2066
余姚方桥店,1999
余姚明伟店,2133
余姚朗霞崇文路店,2213
余姚梁弄镇店,1801
余姚梁辉店,2083
余姚河姆渡店,2112
余姚泗门光明南路店,2203
余姚泗门河塍北路店,2378
余姚泗门镇新店,1989
余姚玉立路店,1859
余姚竹山桥店,1614
余姚肖东石婆桥店,2111
余姚胜山西路店,2000
余姚郑巷振兴路店,2244
余姚金型路店,1981
余姚阳明东路新店,1644
余姚阳明西路店,2168
余姚陆埠二店,1966
余姚陆埠店,2019
余姚马渚镇店,1523
余姚马渚镇新店,2186
余姚黄家埠镇店,2109
余杭临平九曲营路店,1900
余杭仁和和旺街店,2061
余杭勾庄金家渡路店,1786
余杭崇贤崇超路店,1883
北仑九峰西路店,2313
北仑凤洋一路店,2276
北仑华山路店,2205
北仑博地影秀城店,1930
北仑同树路店,1691
北仑大契人民路店,2258
北仑宁职院店,1632
北仑小港季景路店,2081
北仑庐山东路店,2186
北仑弘基广场店,1944
北仑新大路二店,1936
北仑新大路店,2173
北仑明州路店,1774
北仑春晓店,1574
北仑柴桥新店,2189
北仑梅山店,1702
北仑红联地铁站店,1748
北仑红联振兴西路店,1728
北仑红联渡口南路店,2115
台州三门健跳镇店,1950
台州三门南山店,1944
台州三门新兴街店,2083
台州三门梧桐路店,2087
台州三门泰和路店,1784
台州三门西区大道店,1938
台州下陈中心街店,1892
台州临海上盘镇店,1776
台州临海东塍镇店,1215
台州临海大洋店,1791
台州临海大田店,1671
台州临海崇和路店,1891
台州临海星悦城店,1754
台州临海杜桥镇店,1934
台州临海柏叶西路店,1479
台州临海桃渚镇店,1975
台州临海花街店,1608
台州临海郎成时代店,1621
台州临海银泰城店,1757
台州仙居下各镇店,1754
台州仙居吾悦广场店,1946
台州仙居响石山路店,2249
台州仙居横溪镇店,1850
台州仙居白塔店,1710
台州仙居穿城中路店,2039
台州坎门海港西路店,1852
台州天台人民东路店,2277
台州天台劳动路店,2223
台州天台坦头镇店,1
台州天台宝龙天地店,1779
台州天台平桥镇店,2097
台州天台法华路店,2413
台州天台赤城路店,1771
台州杜桥南洋二路店,1689
台州杜桥宝龙广场店,1931
台州杜桥站东路店,1826
台州松门老车站店,2095
台州椒江万达店,1815
台州椒江三甲店,1794
台州椒江下陈店,1470
台州椒江东海大道店,1220
台州椒江中山东路店,1492
台州椒江中山路店,1503
台州椒江前所店,1763
台州椒江商业街店,1619
台州椒江天璟誉府店,1628
台州椒江宝龙广场店,1951
台州椒江市府大道店,1773
台州椒江广场西路店,1867
台州椒江新安路店,1603
台州椒江洪家店,1883
台州椒江海门店,1559
台州椒江章安店,1456
台州椒江葭沚店,1780
台州椒江解放南路店,1389
台州楚门南兴西路店,2053
台州楚门昌业北路店,1668
台州温岭CC广场店,1593
台州温岭万昌中路店,1773
台州温岭九龙店,1183
台州温岭大溪店,1873
台州温岭宝龙店,2186
台州温岭新天地店,2126
台州温岭新河新店,2111
台州温岭时代新店,1687
台州温岭松门岭商店,2040
台州温岭横峰店,1340
台州温岭泽国二店,1472
台州温岭泽国店,2112
台州温岭温峤镇店,1822
台州温岭牧横路店,1600
台州温岭箬横镇店,1673
台州温岭银泰店,2030
台州玉环万达广场店,1857
台州玉环双港新店,1626
台州玉环吾悦广场店,1856
台州玉环城中路店,1975
台州玉环大麦屿新店,2243
台州玉环清港镇新店,2029
台州章安漫悦湾店,1917
台州路桥宏达广场店,1576
台州路桥富仕路店,1655
台州路桥峰江店,1
台州路桥新桥镇店,1316
台州路桥桐屿店,1970
台州路桥横街镇店,1777
台州路桥腾达路店,1784
台州路桥蓬街镇店,1943
台州路桥螺洋店,1665
台州路桥鑫悦广场店,1872
台州路桥银座街店,1943
台州金地中城广场店,2014
台州金清嘉里城店,1928
台州金清建设路店,1804
台州黄岩东官河路店,1678
台州黄岩劳动南路店,1908
台州黄岩吾悦广场店,2291
台州黄岩复元东路店,2165
台州黄岩天佑城店,1835
台州黄岩天长北路店,1948
台州黄岩头陀镇店,1793
台州黄岩新前店,2103
台州黄岩沙埠镇店,1908
台州黄岩澄江店,1587
台州黄岩西城店,1937
台州黄岩院桥镇店,2225
嘉兴乍浦天妃路店,1769
嘉兴南湖余新镇店,1593
嘉兴南湖大桥镇店,1179
嘉兴南湖少年路店,1442
嘉兴嘉善恒太城店,1825
嘉兴嘉善施家北路店,1770
嘉兴嘉善晋阳东路店,1150
嘉兴嘉善解放西路店,1616
嘉兴平湖独山港镇店,1485
嘉兴桐乡大麻镇店,1679
嘉兴桐乡洲泉镇店,1711
嘉兴桐乡濮院店,731
嘉兴海宁七号桥店,1650
嘉兴海宁人民路店,1391
嘉兴海宁斜桥镇店,2195
嘉兴海宁洛隆路店,2000
嘉兴海宁盐仓二店,2199
嘉兴海宁西田城店,1593
嘉兴海宁许村镇店,2062
嘉兴海宁银泰店,1395
嘉兴海盐勤俭北路店,930
嘉兴海盐吾悦广场店,1708
嘉兴海盐百步镇店,1449
嘉兴海盐西塘桥店,1462
嘉兴秀洲名人国际店,1574
嘉兴秀洲洪合镇店,1626
嘉兴许村万朵城店,2131
奉化万达广场店,1878
奉化世纪一百广场店,1898
奉化力邦广场店,2033
奉化大成路店,1402
奉化岳林路店,2066
奉化溪口商业广场店,1888
奉化溪口民国小镇店,1767
奉化溪口银凤广场店,1883
奉化长汀东路店,1876
宁波下应湖下路店,2146
宁波世纪东方广场店,2224
宁波东部银泰城店,1583
宁波五乡镇东街新店,2208
宁波北仑大榭店,1959
宁波北仑小港店,2086
宁波北仑岷山路店,1782
宁波北仑霞浦店,1
宁波印象奉化店,1641
宁波奉化中山路店,2520
宁波奉化南山路店,1678
宁波奉化方桥镇店,1926
宁波奉化江口镇店,1916
宁波奉化江宸府店,2129
宁波奉化舒家店,1927
宁波奉化莼湖镇店,2067
宁波奉化西坞店,1604
宁波奉化锦屏南路店,1
宁波姜山天童南路店,2172
宁波宁大步行街店,2032
宁波宁海兴宁路店,1627
宁波宁海力洋镇店,2013
宁波宁海北斗北路店,1665
宁波宁海应家山店,1994
宁波宁海新桥路店,1656
宁波宁海桃源广场店,1248
宁波宁海桃源里店,1927
宁波宁海桥头胡店,2161
宁波宁海梅林镇店,2123
宁波宁海竹口路店,2172
宁波宁海西子国际店,2305
宁波宁海西店镇店,1538
宁波宁海长街镇店,2088
宁波宏泰广场店,1853
宁波庄桥公园路店,2180
宁波慈城二店,1937
宁波慈城解放路店,2281
宁波杭州湾世纪金源店,2194
宁波杭州湾利时店,2453
宁波杭州湾御海苑店,1323
宁波梅墟奥莱码头店,2102
宁波江东东柳店,1682
宁波江东华严店,1789
宁波江东宁穿路店,1870
宁波江东贺丞路店,1441
宁波江北万达店,2141
宁波江北云创店,1090
宁波江北亲亲家园店,2023
宁波江北华业街店,1522
宁波江北天水家园店,1846
宁波江北来福士店,1639
宁波江北清河路店,1644
宁波江北育才路新店,1320
宁波沧海路店,1684
宁波海德商业中心店,1982
宁波海曙亚细亚店,2390
宁波海曙南苑街店,2290
宁波海曙印象城店,2077
宁波海曙奥特莱斯店,2030
宁波海曙布政店,1622
宁波海曙徐家漕店,1998
宁波海曙恒通广场店,1853
宁波海曙白云店,1711
宁波海曙礼嘉桥店,1413
宁波海曙翠柏店,2057
宁波海曙联丰店,1626
宁波海曙镇明路店,1673
宁波海曙马园路新店,1235
宁波海曙高鑫广场店,2287
宁波海曙鼓楼新店,2233
宁波港隆时代广场店,1554
宁波炼化海丰广场店,1624
宁波甬港南路店,1438
宁波象山万达店,1580
宁波象山大目湾店,1851
宁波象山海港城店,1493
宁波轻纺城华盛店,2038
宁波轻纺城石碶店,2190
宁波轻纺城银亿店,1914
宁波邱隘利时百货店,2113
宁波鄞州万悦集店,1561
宁波鄞州下应乐购店,2006
宁波鄞州东岸里店,1657
宁波鄞州东钱湖店,2087
宁波鄞州中海国际店,1940
宁波鄞州云龙镇店,1965
宁波鄞州古林镇店,2254
宁波鄞州咸祥镇店,2134
宁波鄞州嘉苑广场店,1899
宁波鄞州四明广场店,1590
宁波鄞州堇山中路店,1587
宁波鄞州塘溪镇店,1717
宁波鄞州姜山镇店,1650
宁波鄞州学府1号店,1430
宁波鄞州宝龙广场店,1947
宁波鄞州方圆中心店,2116
宁波鄞州星空里店,1986
宁波鄞州桑田路店,1703
宁波鄞州横溪镇店,1983
宁波鄞州横街镇店,1659
宁波鄞州洞桥镇店,1709
宁波鄞州滨江广场店,1534
宁波鄞州潘火路店,2003
宁波鄞州联盛广场店,2170
宁波鄞州贸城东路店,1807
宁波鄞州鄞江镇店,1494
宁波鄞州长丰店,1711
宁波鄞州集仕港店,1780
宁波鄞州高桥镇店,2290
宁波鄞州龙湖天街店,2202
宁波镇海万科广场店,1953
宁波镇海九龙湖店,1687
宁波镇海吾悦广场店,1341
宁波镇海大西门路店,1484
宁波镇海工程学院店,1422
宁波镇海招宝广场店,1713
宁波镇海生活广场店,2126
宁波镇海骆驼欧尚店,2113
宁波镇海骆驼镇店,2326
宁波集城广场店,1415
宁波骆驼董家畈店,1809
宁波高新宝龙广场店,1892
富阳新登登城南路店,1985
富阳新登秉贤街店,2133
富阳银湖创意路店,1963
慈溪三北镇店,1888
慈溪乌山路新店,2339
慈溪匡堰镇店,2341
慈溪吾悦广场店,2232
慈溪周巷二店,1620
慈溪周巷店,2069
慈溪周巷镇东路店,2292
慈溪坎墩镇店,1946
慈溪城西银泰店,2235
慈溪大润发店,1788
慈溪天九街店,1813
慈溪天元镇店,1966
慈溪孙塘北路店,2023
慈溪宗汉镇新华店,1865
慈溪小安店,1786
慈溪崇寿镇店,2157
慈溪师桥镇店,1920
慈溪庵东镇店,2359
慈溪掌起二店,2083
慈溪掌起店,1925
慈溪新江路店,1798
慈溪新浦镇店,2131
慈溪桥头镇店,1953
慈溪横河镇店,2151
慈溪沧田镇店,1711
慈溪烟火里店,1890
慈溪爱琴海店,2263
慈溪胜山二店,1527
慈溪胜山店,2233
慈溪范市店,2098
慈溪观海卫1店,2074
慈溪观海卫大润发店,2143
慈溪逍林二店,1998
慈溪逍林店,2203
慈溪金一路店,2012
慈溪金水湾店,1468
慈溪长河镇店,1780
慈溪附海镇店,2012
慈溪青少年宫二店,1849
慈溪高王路店,1857
慈溪龙山店,2226
杭州丁桥环丁路店,1708
杭州三墩厚诚路店,1857
杭州上城三里亭店,1561
杭州上城景芳店,2118
杭州上城江城路店,2260
杭州上城近江店,2007
杭州上城通盛路店,1808
杭州上城长睦路店,1724
杭州下城万家星城店,2128
杭州下城三塘店,1945
杭州下城北景园新店,1817
杭州下城朝晖店,2022
杭州下沙七格店,1889
杭州下沙圈圈里店,2204
杭州下沙金隅金座店,1903
杭州世纪城地铁站店,2359
杭州临安临天路店,1443
杭州临安城中街店,1660
杭州临安宝龙店,1594
杭州临安新天地店,2060
杭州临安於潜镇店,2018
杭州临安昌化镇店,1641
杭州临安石镜街店,1586
杭州临安西墅街店,1727
杭州临安高虹镇店,1202
杭州临平上环桥路店,2231
杭州临平世纪大道店,1936
杭州临平南兴路店,1988
杭州临平南大街二店,2206
杭州临平南大街店,1512
杭州临平天都城店,1937
杭州临平振兴西路店,1739
杭州临平新环广场店,1862
杭州临平算力小镇店,2199
杭州临平绿荫街店,1556
杭州临平翁家埠店,1774
杭州临平长宁路店,1843
杭州临江润东街店,1885
杭州义蓬二店,2196
杭州之江银泰店,2248
杭州乔司华荣城店,1508
杭州乔司大井店,1723
杭州九堡金海百货店,2006
杭州余杭上祥路店,1742
杭州余杭中泰路店,1559
杭州余杭五常店,1470
杭州余杭仙塘西街店,1610
杭州余杭保庆街店,1710
杭州余杭凤凰山路店,1916
杭州余杭北沙西路店,2085
杭州余杭城南路店,1914
杭州余杭星桥店,1762
杭州余杭泽怀广场店,1754
杭州余杭润达广场店,1895
杭州余杭狮山路店,2040
杭州余杭瓶窑镇店,1989
杭州余杭白洋店,1958
杭州余杭良渚店,2313
杭州余杭逸盛路店,1846
杭州余杭闲林二店,1524
杭州余杭闲林镇店,2039
杭州塘栖古镇店,2161
杭州复地活力广场店,1770
杭州大江东宝龙店,1803
杭州富阳东洲店,2132
杭州富阳九龙店,2067
杭州富阳大源镇店,1909
杭州富阳彩虹路店,2121
杭州富阳文教路店,1579
杭州富阳桂花西路店,1563
杭州富阳江连街店,1758
杭州富阳苋浦西路店,1674
杭州富阳金桥北路店,2083
杭州富阳金浦路店,1794
杭州富阳银泰店,2211
杭州富阳龙浦街店,1862
杭州崇贤向阳路店,2048
杭州建国北路新店,2146
杭州建德乾潭镇店,1464
杭州建德寿昌镇店,2073
杭州建德梅城镇店,2015
杭州建德汇丰商厦店,1890
杭州建德洋安店,1765
杭州拱墅万融城店,1381
杭州拱墅上绍路店,1
杭州拱墅半山路店,1536
杭州拱墅台州路店,1918
杭州拱墅吾悦广场店,1831
杭州拱墅和睦路店,1782
杭州拱墅拱宸桥店,1835
杭州拱墅新华路店,2091
杭州拱墅桃源街店,1701
杭州拱墅永庆路店,1592
杭州拱墅萍水路新店,1725
杭州拱墅长阳路店,1434
杭州拱墅香积寺新店,1821
杭州星桥星韵路店,1939
杭州桐庐中杭路店,1963
杭州桐庐佳庭汇店,2104
杭州桐庐分水镇店,2125
杭州桐庐春江东路店,1267
杭州桐庐梅林路店,1559
杭州桐庐横村镇店,1564
杭州江干区东东城店,2304
杭州江干区学林街店,1281
杭州江干区文汇苑店,2089
杭州江干杭乔路店,2293
杭州江干金沙湖店,1866
杭州淳安新安大街二店,1780
杭州淳安新安大街店,2238
杭州湖墅南路新店,1991
杭州滨江三秋路店,1956
杭州滨江东冠路店,2276
杭州滨江春波路店,2218
杭州滨江月明路店,1963
杭州滨江滨盛路店,2041
杭州滨江西浦路店,1730
杭州滨江连园店,2175
杭州瓶窑嘉凯城店,2130
杭州科技城宝龙店,1978
杭州绿城吉祥里店,1469
杭州良渚未来之光店,2161
杭州萧山东瑞四路店,1854
杭州萧山义蓬店,2070
杭州萧山党山镇店,2116
杭州萧山利丰路店,2056
杭州萧山所前镇店,2188
杭州萧山新湾镇店,2012
杭州萧山明星路店,2051
杭州萧山益农镇店,2045
杭州萧山萧绍路店,2048
杭州萧山韵动城店,1956
杭州西湖双浦镇店,1879
杭州西湖文一路店,2438
杭州西湖文三西路店,1913
杭州西湖来仁街店,1727
杭州西湖池华街店,1765
杭州西湖留和家苑店,2101
杭州西湖西雅苑店,1891
杭州西湖贝家街店,1849
杭州西湖转塘直街店,1989
杭州西溪欢乐城店,1948
杭州转塘之江店,1765
杭州转塘创意路店,2193
杭州钱塘区前进店,1708
杭州钱塘区高沙店,1900
杭州青山湖宝龙店,1596
桐乡崇福商业中心店,2098
永康西津步行街店,2331
永康长城九州西路店,1848
海宁长安修川路店,1697
海宁长安平川路店,1915
温岭城北商业中心店,1675
温州5050广场店,1728
温州上塘县前路店,1274
温州乐清七里港店,1711
温州乐清宝龙广场店,2169
温州乐清汇丰路店,1673
温州乐清百佳广场店,1708
温州乐清翁垟镇店,1910
温州乐清蒲岐镇店,2022
温州乐清虹桥镇二店,1729
温州乐清虹桥镇店,2270
温州乐清金溪路店,1873
温州乐清雁荡镇店,1644
温州乐清鸣阳路店,48
温州北白象东大街店,1822
温州大荆财富店,1540
温州平阳万全镇店,1678
温州平阳横阳路店,2087
温州平阳水头店,1533
温州平阳百悦广场店,1971
温州平阳联东北路店,1874
温州平阳萧江镇店,1738
温州平阳郑楼镇店,1826
温州文成建设路店,2171
温州新桥金蟾大道店,1558
温州柳市中梁首府店,425
温州柳市柳青南路店,2011
温州柳市现代广场店,1737
温州梧田大堡底店,2138
温州水头财富广场店,1387
温州永嘉上塘镇店,1717
温州永嘉乌牛镇店,1655
温州永嘉桥下镇店,1990
温州永嘉桥头镇店,1525
温州泰顺北大街店,1768
温州泰顺金都花园店,1584
温州泰顺青草湾店,1245
温州洞头海湾家园店,1
温州洞头霞晖路新店,2146
温州灵溪仁英路店,1838
温州灵溪新天地店,1716
温州灵溪明珠苑店,1614
温州灵溪玉苍路店,2004
温州瑞安万松东路店,1784
温州瑞安云周店,1662
温州瑞安仙降二店,1725
温州瑞安仙降镇店,2246
温州瑞安吾悦广场店,2196
温州瑞安场桥店,1755
温州瑞安安阳南路店,1674
温州瑞安安阳路店,1645
温州瑞安汀田店,1846
温州瑞安沿江东路店,1830
温州瑞安瑞源华府店,1357
温州瑞安瑞祥店,1763
温州瑞安瑞立广场店,1833
温州瑞安莘塍镇店,2011
温州瑞安莘阳大道店,1668
温州瑞安虹桥北路店,2500
温州瑞安虹桥路店,2030
温州瑞安陶山镇店,1529
温州瑞安飞云镇店,1928
温州瑞安马屿镇店,2033
温州瓯北中楠广场店,1675
温州瓯北五星堡一店,1532
温州瓯北双塔路店,1659
温州瓯北置诚广场店,1622
温州瓯海万象城店,2172
温州瓯海东垟东路店,1665
温州瓯海中庚广场店,1817
温州瓯海仙岩镇店,2059
温州瓯海半塘路店,1990
温州瓯海南旭嘉园店,1882
温州瓯海欢乐天地店,1639
温州瓯海茶山镇店,1577
温州瓯海郭溪镇店,1727
温州瓯海鑫汇家园店,2203
温州瓯海龙霞路店,1990
温州瞿溪新天地店,1942
温州美美时尚店,1825
温州苍南宜山镇店,2063
温州苍南金乡镇店,1351
温州苍南钱库镇店,2072
温州苍南马站镇店,1519
温州苍南龙跃路店,1686
温州西江月印象里店,1448
温州马鞍池东路店,1915
温州鳌江万达广场店,1517
温州鳌江兴鳌中路店,1264
温州鳌江巴黎城店,1645
温州鳌江新河路店,1790
温州鹿城中洲大厦店,1894
温州鹿城仰义店,1656
温州鹿城公园路店,1969
温州鹿城划龙桥路店,1092
温州鹿城南塘街店,1684
温州鹿城印象城店,1665
温州鹿城学院中路店,2137
温州鹿城府前街店,1931
温州鹿城恒隆广场店,2065
温州鹿城新城大道店,1559
温州鹿城时尚港店,1626
温州鹿城欧洲城店,1877
温州鹿城汤家桥店,1950
温州鹿城温金路店,1459
温州鹿城环城东路店,1505
温州鹿城白麓里店,1278
温州鹿城百里店,1504
温州鹿城站东店,2021
温州鹿城藤桥镇店,2099
温州鹿城西城路店,1986
温州鹿城里垟新路店,1942
温州鹿城飞霞南路店,1590
温州鹿城黄龙店,2056
温州鹿城龟湖路店,1743
温州黄龙康城广场店,1769
温州龙港下埠店,2053
温州龙港华电路店,1778
温州龙港财富中心店,2137
温州龙港金茂花园店,2525
温州龙湾万达店,1710
温州龙湾人民南路店,1691
温州龙湾吾悦广场店,1777
温州龙湾括苍西路店,1772
温州龙湾永中西路店,1949
温州龙湾永强大道店,1990
温州龙湾滨海六路店,1909
温州龙湾状元店,1954
温州龙湾罗东街店,1811
温州龙湾财智大厦店,1976
湖州安吉孝丰店,1331
湖州德清乾元店,1811
湖州德清兴康北路店,1593
湖州德清城东店,1520
湖州德清新市镇店,1298
湖州德清舞阳街店,1415
瑞安塘下中心路店,2207
瑞安塘下塘西店,1674
瑞安塘下广场中路店,1141
瑞安塘下香港城店,1816
瑞安塘下鲍田店,1705
瑞安新湖银泰城店,1847
瑞安莘塍镇府路店,1379
绍兴上虞章镇店,1770
绍兴东浦锡鳞路店,1865
绍兴冠城商业广场店,1493
绍兴古城北店,1585
绍兴安昌镇店,1875
绍兴嵊州三江城店,1915
绍兴嵊州三界镇店,1737
绍兴嵊州仙湖路店,1139
绍兴嵊州北直街店,1520
绍兴嵊州和悦广场店,2088
绍兴嵊州官河路店,938
绍兴嵊州新国商店,1641
绍兴嵊州甘霖镇店,1692
绍兴嵊州碧桂园店,1723
绍兴嵊州莲塘店,1831
绍兴嵊州蓝光店,1789
绍兴嵊州西后街新店,1217
绍兴嵊州西皮茂店,1688
绍兴嵊州长乐镇店,1903
绍兴嵊州长安路店,1960
绍兴嵊州黄泽镇店,1632
绍兴新昌万达广场店,1971
绍兴新昌人民东路店,1841
绍兴新昌人民中路店,1841
绍兴新昌尚礼苑店,1765
绍兴新昌拔茅店,1752
绍兴新昌泰坦大道店,2195
绍兴新昌西江月店,1670
绍兴新昌鼓山中路店,1723
绍兴杨汛桥商贸城店,2045
绍兴杨汛桥江桥路店,1986
绍兴柯岩梅泽嘉园店,2258
绍兴柯桥万达广场店,2003
绍兴柯桥云集路店,1652
绍兴柯桥兰亭镇店,1927
绍兴柯桥华舍店,2228
绍兴柯桥双周店,2183
绍兴柯桥双渎路店,1768
绍兴柯桥夏履镇店,1771
绍兴柯桥大坂风情店,1465
绍兴柯桥平水镇店,1995
绍兴柯桥恒宇锦园店,2038
绍兴柯桥明园店,1116
绍兴柯桥港越路店,1432
绍兴柯桥湖中路店,1563
绍兴柯桥滨海万达店,2281
绍兴柯桥漓渚镇店,1997
绍兴柯桥碧水金柯店,1664
绍兴柯桥福全镇店,2063
绍兴柯桥耶溪路店,1841
绍兴柯桥鉴湖路店,2008
绍兴柯桥银泰城店,1742
绍兴柯桥马鞍镇店,1621
绍兴沥海综合市场店,2037
绍兴滨海群商路店,2047
绍兴滨海镜海大道店,1968
绍兴袍江丽都花园店,2009
绍兴袍江宝龙广场店,1672
绍兴袍江斗门镇店,1810
绍兴袍江益泉百货店,1810
绍兴诸暨三都路店,1802
绍兴诸暨上海城店,1982
绍兴诸暨东兴路店,2051
绍兴诸暨东祥路店,1552
绍兴诸暨健民路店,1671
绍兴诸暨八一路店,1646
绍兴诸暨和泰路店,1766
绍兴诸暨安华镇店,1990
绍兴诸暨宝龙广场店,1872
绍兴诸暨山下湖镇店,2049
绍兴诸暨新天地店,1809
绍兴诸暨旺达路店,1867
绍兴诸暨春江路店,1802
绍兴诸暨杨梅桥店,1885
绍兴诸暨枫桥镇店,1876
绍兴诸暨次坞镇店,1735
绍兴诸暨浣东北路店,1473
绍兴诸暨湄池店,1849
绍兴诸暨牌头镇店,1664
绍兴诸暨璜山镇店,1814
绍兴诸暨草塔镇店,1775
绍兴诸暨西子公寓店,1616
绍兴诸暨飨街店,1700
绍兴越城世纪东街店,1673
绍兴越城世茂广场店,1736
绍兴越城东光街店,1679
绍兴越城中兴中路店,1669
绍兴越城中兴北路店,1722
绍兴越城中兴南路店,1456
绍兴越城人民东路店,2101
绍兴越城剡溪路店,2004
绍兴越城后墅路店,1565
绍兴越城国商店,4
绍兴越城城南店,1757
绍兴越城天悦城店,1562
绍兴越城孙端镇店,2022
绍兴越城建功店,1190
绍兴越城旭辉广场店,1701
绍兴越城昌明街店,1325
绍兴越城泓盛广场店,1900
绍兴越城皋埠二店,1970
绍兴越城皋埠镇店,2048
绍兴越城胜利西路店,1967
绍兴越城袍中路店,2082
绍兴越城袍渎路店,1951
绍兴越城解放南路店,1334
绍兴越城迎恩门店,1180
绍兴越城鉴湖镇店,2138
绍兴越城鲁迅路店,1459
绍兴越城龙湖天街店,1895
绍兴金地自在城店,2146
绍兴金帝银泰城店,1227
绍兴钱清西后街店,2207
绍兴钱清钱门大道店,1829
绍兴镜湖凤林西路店,1713
绍兴马山车站路店,2092
绍兴齐贤聚贤街店,2236
舟山东港云谷店,2057
舟山东港香榭街店,2123
舟山人民中路新店,1
舟山定海白泉镇店,1914
舟山定海解放东路新店,2113
舟山宝龙广场店,2301
舟山岱山兰秀大道店,2093
舟山岱山日达广场店,2465
舟山岱山长河路店,2122
